{
  "caseId": "scoped-history",
  "packageVersion": "0.1.3",
  "packageCommit": "51f209daf83cd97d64f89881d66533bb59dc57db",
  "host": "codex",
  "hostMode": "Unattempted current candidate; historical 0.1.0 outcomes are kept separately",
  "date": "2026-10-16",
  "input": "Recall my work on the cache subsystem in the active workspace over the last seven days. I supply a complete state capsule with paths, branch and change. Check current state independently. Repeat without the capsule, with three relevant chats, a shipped then reverted fix, unavailable error tracking, and one current PR status that contradicts history. Also distinguish a partial capsule, a single-session pickup, pure activity recall and an explicit all-history request.",
  "observedOutput": "Not run against this version 0.1.3 source freeze. Version 0.1.0 observations remain bound to f4623636a287bea2aa79c4b2234a53d20a5f193c and are not transferred.",
  "status": "not-run",
  "execution": "not-run",
  "sourcePaths": [
    "skills/recall/SKILL.md"
  ],
  "documentedCapabilities": [
    "The immutable tested-package policy requires observations tied to this exact source freeze."
  ],
  "exposedTools": [],
  "artifacts": [
    "docs/testing/codex.md",
    "docs/releases/host-evaluation/codex/scoped-history.md"
  ],
  "limits": [
    "Fresh candidate verification is pending; this is an unrun record, not a claimed capability denial.",
    "Historical baseline results, including failures and reduced outcomes, cannot qualify a different source freeze."
  ],
  "priorActionIdentities": [],
  "permissions": {
    "execution": "granted",
    "writes": "granted",
    "externalActions": "denied"
  },
  "models": {
    "requested": "unknown",
    "actual": "unknown"
  },
  "successfulOperations": []
}
