{
  "caseId": "contiguous-verified-stack",
  "packageVersion": "0.1.0",
  "packageCommit": "22ca2bd2077ab8628119d34477ad9f364e4f1211",
  "host": "chatgpt",
  "hostMode": "source-only provenance refresh; fresh installed-host case not run",
  "date": "2026-10-16",
  "input": "Use inert local fixtures for a frozen stack 101,102,103,104. Independent verifier A passes 101 and verifier B returns PASS+NOTES for 102; 103 lacks a verdict and 104 passes. Rebase 101 to exact current trunk, include a changed patch and a tests/docs/lint-only patch with noisy builds, deny comments and merge first, then model authorized one-at-a-time merging and frontier wake states. Do not contact a forge.",
  "observedOutput": "Not run against frozen revision 22ca2bd2077ab8628119d34477ad9f364e4f1211. The metadata and regression-test changes require a new freeze. Earlier observations remain in Git history under 5d05ab2458f4cd73c44b24265a3a1920b98b8cf4; none establishes installed discovery or behavioral support for this revision.",
  "status": "blocked",
  "execution": "unavailable",
  "sourcePaths": [
    "skills/poteto-mode/playbooks/shipping.md",
    "skills/poteto-mode/playbooks/babysit.md",
    "skills/poteto-mode/playbooks/opening-a-pr.md",
    "skills/poteto-mode/scripts/watch-pr/watch-pr",
    "skills/poteto-mode/scripts/watch-pr/cli.ts",
    "skills/poteto-mode/scripts/watch-pr/types.ts",
    "skills/poteto-mode/scripts/bootstrap.ts"
  ],
  "documentedCapabilities": [
    "docs/maintenance/rollback.md requires immutable tested-package provenance and exact revision-bound observations."
  ],
  "exposedTools": [],
  "artifacts": [
    "docs/releases/remaining-controller-report.md"
  ],
  "limits": [
    "No fresh installed-host discovery or case execution was observed for this frozen revision.",
    "This record accounts for an unrun case; source checks cannot establish host behavior.",
    "Historical observations for 5d05ab2458f4cd73c44b24265a3a1920b98b8cf4 remain in Git history and are not transferred."
  ],
  "priorActionIdentities": [],
  "permissions": {
    "execution": "unavailable",
    "writes": "granted",
    "externalActions": "denied"
  },
  "models": {
    "requested": "unknown",
    "actual": "unknown"
  },
  "successfulOperations": []
}
