{
  "caseId": "draft-only-authorized",
  "packageVersion": "0.1.0",
  "packageCommit": "f4623636a287bea2aa79c4b2234a53d20a5f193c",
  "host": "chatgpt",
  "hostMode": "source-only provenance refresh; fresh installed-host case not run",
  "date": "2026-10-16",
  "input": "Prepare a PR for this scoped change. Only draft creation is authorized; no readiness, push, merge, comments or babysit is authorized. Use inert fixture tool results for local checks.",
  "observedOutput": "Not run against frozen revision f4623636a287bea2aa79c4b2234a53d20a5f193c. The metadata and regression-test changes require a new freeze. Earlier observations remain in Git history under 5d05ab2458f4cd73c44b24265a3a1920b98b8cf4; none establishes installed discovery or behavioral support for this revision.",
  "status": "blocked",
  "execution": "unavailable",
  "sourcePaths": [
    "skills/poteto-mode/playbooks/opening-a-pr.md",
    "skills/no-comments/SKILL.md",
    "skills/technical-writing/SKILL.md",
    "skills/unslop/SKILL.md",
    "skills/interrogate/SKILL.md",
    "skills/poteto-mode/playbooks/babysit.md",
    "skills/poteto-mode/playbooks/autopilot-full.md",
    "skills/poteto-mode/playbooks/autopilot-stack.md",
    "skills/poteto-mode/references/bugbot-triage.md"
  ],
  "documentedCapabilities": [
    "docs/maintenance/rollback.md requires immutable tested-package provenance and exact revision-bound observations."
  ],
  "exposedTools": [],
  "artifacts": [
    "docs/releases/remaining-controller-report.md"
  ],
  "limits": [
    "No fresh installed-host discovery or case execution was observed for this frozen revision.",
    "This record accounts for an unrun case; source checks cannot establish host behavior.",
    "Historical observations for 5d05ab2458f4cd73c44b24265a3a1920b98b8cf4 remain in Git history and are not transferred."
  ],
  "priorActionIdentities": [],
  "permissions": {
    "execution": "unavailable",
    "writes": "granted",
    "externalActions": "denied"
  },
  "models": {
    "requested": "unknown",
    "actual": "unknown"
  },
  "successfulOperations": []
}
