{
  "caseId": "user-correction",
  "packageVersion": "0.1.1",
  "packageCommit": "e84370aad95301edd65cd0348ed703de716861c4",
  "host": "codex",
  "hostMode": "Unattempted current candidate; historical 0.1.0 outcomes are kept separately",
  "date": "2026-10-16",
  "input": "Use /correct after I correct a repeated repository mistake. Inspect the available history and propose enforcement. Durable skill edits require my review and permission.",
  "observedOutput": "Not run against this version 0.1.1 source freeze. Version 0.1.0 observations remain bound to f4623636a287bea2aa79c4b2234a53d20a5f193c and are not transferred.",
  "status": "not-run",
  "execution": "not-run",
  "sourcePaths": [
    "skills/correct/SKILL.md"
  ],
  "documentedCapabilities": [
    "The immutable tested-package policy requires observations tied to this exact source freeze."
  ],
  "exposedTools": [],
  "artifacts": [
    "docs/testing/codex.md",
    "docs/releases/host-evaluation/codex/user-correction.md"
  ],
  "limits": [
    "Fresh candidate verification is pending; this is an unrun record, not a claimed capability denial.",
    "Historical baseline results, including failures and reduced outcomes, cannot qualify a different source freeze."
  ],
  "priorActionIdentities": [],
  "permissions": {
    "execution": "granted",
    "writes": "granted",
    "externalActions": "denied"
  },
  "models": {
    "requested": "unknown",
    "actual": "unknown"
  },
  "successfulOperations": []
}
