{
  "caseId": "package-support-contracts",
  "packageVersion": "0.1.0",
  "packageCommit": "f4623636a287bea2aa79c4b2234a53d20a5f193c",
  "host": "chatgpt",
  "hostMode": "source-only provenance refresh; fresh installed-host case not run",
  "date": "2026-10-16",
  "input": "Inspect the support contracts of the actual installed frozen package. Read its attribution and entry-point links, inspect its canonical logo, verify ignore boundaries in a separately authorized owned copy, and exercise the watcher compile fixture only with existing approved dependencies and execution.",
  "observedOutput": "Not run against frozen revision f4623636a287bea2aa79c4b2234a53d20a5f193c. The metadata and regression-test changes require a new freeze. Earlier observations remain in Git history under 5d05ab2458f4cd73c44b24265a3a1920b98b8cf4; none establishes installed discovery or behavioral support for this revision.",
  "status": "blocked",
  "execution": "unavailable",
  "sourcePaths": [
    ".gitignore",
    "LICENSE",
    "README.md",
    "assets/logo.png",
    "skills/poteto-mode/scripts/watch-pr/tsconfig.json",
    "skills/poteto-mode/scripts/watch-pr/types.compile.ts"
  ],
  "documentedCapabilities": [
    "docs/maintenance/rollback.md requires immutable tested-package provenance and exact revision-bound observations."
  ],
  "exposedTools": [],
  "artifacts": [
    "docs/releases/remaining-controller-report.md"
  ],
  "limits": [
    "No fresh installed-host discovery or case execution was observed for this frozen revision.",
    "This record accounts for an unrun case; source checks cannot establish host behavior.",
    "Historical observations for 5d05ab2458f4cd73c44b24265a3a1920b98b8cf4 remain in Git history and are not transferred."
  ],
  "priorActionIdentities": [],
  "permissions": {
    "execution": "unavailable",
    "writes": "granted",
    "externalActions": "denied"
  },
  "models": {
    "requested": "unknown",
    "actual": "unknown"
  },
  "successfulOperations": []
}
